StudentID,Answer,Score
1,"Komputer adalah serangkaian ataupun sekelompok mesin elektronik yang terdiri dari ribuan bahkan jutaan komponen yang dapat saling bekerja sama, serta membentuk sebuah sistem kerja yang rapi dan teliti. Sistem ini kemudian dapat digunakan untuk melaksanakan serangkaian pekerjaan secara otomatis, berdasar urutan instruksi ataupun program yang diberikan kepadanya. ",76.67
2,komputer adalah mesin penghitung ,11.67
3,mesin yang membantu manusia untuk menjalankan segara pekerjaan ,25.00
4,"Komputer adalah alat komputasi yang diciptakan untuk menghitung tambah, kurang, kali, bagi. ",10.67
5,alat untuk memudahkan masnusia ,11.33
6,"Komputer adalah alat yang dipakai untuk mengolah data menurut prosedur yang telah dirumuskan. Kata computer pada awalnya dipergunakan untuk menggambarkan orang yang perkerjaannya melakukan perhitungan aritmatika, dengan atau tanpa alat bantu, tetapi arti kata ini kemudian dipindahkan kepada mesin itu sendiri. Asal mulanya, pengolahan informasi hampir eksklusif berhubungan dengan masalah aritmetika, tetapi komputer modern dipakai untuk banyak tugas yang tidak berhubungan dengan matematika. ",25.00
7,komputer merupakan alat untuk mengolah data. melakukan perhitungan aritmatika dan melakukan segala pekerjaan yang dapat memudahkan manusia ,43.33
8,"Komputer adalah alat yang dipakai untuk mengolah data menurut prosedur yang telah dirumuskan. Kata computer pada awalnya dipergunakan untuk menggambarkan orang yang perkerjaannya melakukan perhitungan aritmatika, dengan atau tanpa alat bantu, tetapi arti kata ini kemudian dipindahkan kepada mesin itu sendiri. ",29.33
9,"Komputer adalah alat yang dipakai untuk mengolah data menurut prosedur yang telah dirumuskan. Kata computer pada awalnya dipergunakan untuk menggambarkan orang yang perkerjaannya melakukan perhitungan aritmatika, dengan atau tanpa alat bantu, tetapi arti kata ini kemudian dipindahkan kepada mesin itu sendiri. ",29.33
10,"Komputer adalah serangkaian ataupun sekelompok mesin elektronik yang terdiri dari ribuan bahkan jutaan komponen yang dapat saling bekerja sama, serta membentuk sebuah sistem kerja yang rapi dan teliti. Sistem ini kemudian dapat digunakan untuk melaksanakan serangkaian pekerjaan secara otomatis, berdasar urutan instruksi ataupun program yang diberikan kepadanya. ",60.00
11,"Komputer adalah alat yang dipakai untuk mengolah data menurut prosedur yang telah dirumuskan. Kata komputer pada awalnya dipergunakan untuk menggambarkan orang yang perkerjaannya melakukan perhitungan aritmatika, dengan atau tanpa alat bantu, tetapi arti kata ini kemudian dipindahkan kepada mesin itu sendiri ",39.33
12,alat yang dipakai untuk mengolah data menurut prosedur yang telah dirumuskan ,25.00
13,komputer adalah barang elektronik pintar yang semakin tahun dikembangkan dengan menambahkan banyak fitur dan komponen tambahan yang kemudian disatu padukan menjadi bentuk. ,19.33
14,"Komputer adalah alat yang dipakai untuk mengolah data menurut prosedur yang telah dirumuskan. Kata computer pada awalnya dipergunakan untuk menggambarkan orang yang perkerjaannya melakukan perhitungan aritmatika, dengan atau tanpa alat bantu, tetapi arti kata ini kemudian dipindahkan kepada mesin itu sendiri. ",31.00
15,alat bantu untuk mempermudah pekerjaan manusia ,27.67
16,komputer adalah alat untuk mempermudah manusia dalam melakukan aktivitas shari hari ,28.33
17,Komputer adalah sebuah perangkat yang saat ini digunakan untuk berbagai keperluan. Fungsi komputer sendiri banyak namun pada dasarnya komputer digunakan sebagai alat berhitung dan mengolah informasi. Komputer bisa menerima inputan dari perangkat inputan seperti keyboard dan mouse kemudian mengeluarkan hasil melalui perangkat output seperti printer dan juga monitor ,28.33
18,serangkaian atau sekelompok mesin elektronik yang terdiri dari ratusan komponen yang saling bekerja sama ,31.67
19,"Komputer adalah serangkaian ataupun sekelompok mesin elektronik yang terdiri dari ribuan bahkan jutaan komponen yang dapat saling bekerja sama, serta membentuk sebuah sistem kerja yang rapi dan teliti. Sistem ini kemudian dapat digunakan untuk melaksanakan serangkaian pekerjaan secara otomatis, berdasar urutan instruksi ataupun program yang diberikan kepadanya. ",60.00
20,alat yang membantu manusia untuk mengerjakan pekerjaan ,25.00
21,"Komputer adalah alat yang dipakai untuk mengolah data menurut prosedur yang telah dirumuskan. Kata computer pada awalnya dipergunakan untuk menggambarkan orang yang perkerjaannya melakukan perhitungan aritmatika, dengan atau tanpa alat bantu, tetapi arti kata ini kemudian dipindahkan kepada mesin itu sendiri. ",30.00
22,Apa yang dimaksud dengan komputer? (Jawab dalam 1-3 kalimat) ,6.00
23,"Komputer adalah alat yang dapat digunakan untuk mengolah suatu data menurut prosedur yang telah dirumuskan dalam komputer itu sendiri. komputer juga dapat digunakan untuk membantu perhitungan aritmetika, serta untuk pengolahan suatu informasi. ",31.67
24,suatu mesin yang bisa mengerti saya ,5.33
25,komputer adalah alat pengolah data menurut prosedur yang telah di rumuskan ,25.00
26,"komputer adalah alat elektronik yang memiliki komputasi yang sangat tinggi dengan spesifikasi seperti menggunakan windows 10 untuk kerjaan kantor, bermain game, menonton film. ",21.67
27,"Komputer adalah alat bantu hitung manusia, yang sekarang sudah dikembangkan dapat membantu banyak tugas manusia. ",29.67
28,"alat elektronik yang dapat menghitung dan menganalisa data secara cepat dan cermat, dapat juga menjalankan aplikasi multimedia. ",20.67
29,alat yang dipakai untuk mengelola data ,10.67
30,"adalah alat yang dipakai untuk mengolah data menurut prosedur yang telah dirumuskan. Kata computer pada awalnya dipergunakan untuk menggambarkan orang yang perkerjaannya melakukan perhitungan aritmatika, dengan atau tanpa alat bantu, tetapi arti kata ini kemudian dipindahkan kepada mesin itu sendiri. Asal mulanya, pengolahan informasi hampir eksklusif berhubungan dengan masalah aritmetika, tetapi komputer modern dipakai untuk banyak tugas yang tidak berhubungan dengan matematika. ",39.33
31,"pada awal komputer adalah mesin hitung untuk memudahkan pekerjaan manusia. saat ini komputer dapat digunakan untuk hal lain seperti bermain game, bekerja, mendengarkan musik dll. ",26.33
32,Komputer adalah mesin hitung. komputer digunakan untuk mengolah data dengan menggunakn mesin. Komputer saat ini sudah berkembang secara pesat. ,20.67
33,"Komputer adalah alat yang dipakai untuk mengolah data menurut prosedur yang telah dirumuskan. Kata computer pada awalnya dipergunakan untuk menggambarkan orang yang perkerjaannya melakukan perhitungan aritmatika, dengan atau tanpa alat bantu, tetapi arti kata ini kemudian dipindahkan kepada mesin itu sendiri. Asal mulanya, pengolahan informasi hampir eksklusif berhubungan dengan masalah aritmetika, tetapi komputer modern dipakai untuk banyak tugas yang tidak berhubungan dengan matematika. ",41.00
34,alat yang dipakai untuk mengolah data menurut prosedur yang telah dirumuskan dimana komputer itu sendiri merupakan perangkat elektronik yang terdiri dari beberapa komponen yang saling bekerja sama membentuk sebuah sistem kerja yang dapat menjalankan pekerjaan secara otomatis berdasar urutan instruksi ataupun program yang diberikan kepadanya sehingga dapat menghasilkan suatu informasi berdasarkan program dan data yang ada. ,29.33
35,Secara umum komputer adalah sekumpulan alat elektronik dimana satu dengan yang lainnya saling bekerja sama terkoordinasi dibawah kontrol program dengan kemampuan dapat menerima data dan mengolah data. ,28.33
36,"Komputer adalah alat yang dipakai untuk mengolah data menurut prosedur yang telah dirumuskan. Kata computer pada awalnya dipergunakan untuk menggambarkan orang yang perkerjaannya melakukan perhitungan aritmatika, dengan atau tanpa alat bantu, tetapi arti kata ini kemudian dipindahkan kepada mesin itu sendiri. ",29.33
37,"Komputer adalah alat yang dipakai untuk mengolah data menurut prosedur yang telah dirumuskan. Kata computer pada awalnya dipergunakan untuk menggambarkan orang yang perkerjaannya melakukan perhitungan aritmatika, dengan atau tanpa alat bantu, tetapi arti kata ini kemudian dipindahkan kepada mesin itu sendiri. Asal mulanya, pengolahan informasi hampir eksklusif berhubungan dengan masalah aritmetika, tetapi komputer modern dipakai untuk banyak tugas yang tidak berhubungan dengan matematika. ",40.00
38,Komputer adalah alat yang dipakai untuk mengolah data menurut prosedur yang telah dirumuskan ,26.67
39,"adalah alat yang dipakai untuk mengolah data menurut prosedur yang telah dirumuskan. Kata computer pada awalnya dipergunakan untuk menggambarkan orang yang perkerjaannya melakukan perhitungan aritmatika, dengan atau tanpa alat bantu, tetapi arti kata ini kemudian dipindahkan kepada mesin itu sendiri. ",28.33
40,"menerima, mengolah dan memberikan informasi ",7.33
41,tempat menerima dan mengolah data ,6.00
42,"Komputer adalah sebuah alat yang digunakan untuk manipulasi data, komputer berisi hardware, software, dan brainware. ",11.67
43,"komputer adalah sebuah mesin yang berfungsi untuk mempermudah pekerjaan manusia yang berawal dari mesin ketik biasa, komputer menggunakan bahasa mesin. ",25.33
44,mesin pegolah kata ,6.33
45,komputer adalah sebuah hardware yg berfungsi membantu manusia untuk bekerja ,21.67
46,alat untuk mempermudah pekerjaan manusia. alat untuk mempersingkat waktu dalam pekerjaan ,22.33
47,komputer adalah alat bantu manusia yang dapat digunakan untuk mempermudah pekerjaan manusia ,25.00
48,"komputer adalah alat komputasi elektronik. yang mana berguna untuk meringankan pekerjaan manusia dalam proses perhitungan, pengolahan data, dan lainnya. ",24.33
49,"alat yang dipakai untuk mengolah data menurut prosedur yang telah dirumuskan. Kata computer pada awalnya dipergunakan untuk menggambarkan orang yang perkerjaannya melakukan perhitungan aritmatika, dengan atau tanpa alat bantu, tetapi arti kata ini kemudian dipindahkan kepada mesin itu sendiri. ",28.67
50,"Serangkaian ataupun sekelompok mesin elektronik yang terdiri dari ribuan bahkan jutaan komponen yang dapat saling bekerja sama, serta membentuk sebuah sistem kerja yang rapi dan teliti. ",27.33
51,komputer adalah alat yang digunakan untuk mengolah data dan angka ,10.67
52,alat elektronik yang terdiri dari hardware dan software untuk mejalankan atau melakukan tugas tertentu ,12.33
