Jawaban_Mahasiswa,Kode_Jawaban_Dosen,Nilai_Human_Rated,Nilai_Huruf
LCD = liquid crystal display CPU = central processing unit GPS = Global Positioning System ,te_7,100,A
LCD = liquid crystal display CPU=Central personal unit ,te_7,69,B
"liquid crystal display, central processor unit, global positioning system. ",te_7,77,B
"LCD = Liquid Cristal Display, CPU = Central Processing Unit, GPS = Global Place System ",te_7,78,B
- LCD (Liquid Crystal Display) - CPU (centrak process Unit) -GPS (Global Positioning System),te_7,78,B
"LCD Liquid Crystal Display, CPu Central Processing Unit, GPS Graphical Position Satellite. ",te_7,75,B
"liquid-crystal display,pronounced as separate letters,The Global Positioning System ",te_7,56,C
"LCD lead cristal display , CPU central processor unit ",te_7,44,C
"LCD (Limited Crystal Diode), CPU(Central Processing Unit), GPS(Global ) ",te_7,45,C
-LCD adalah licuid Display -CPU adalah centar Processing Unit -GPS adalah Global position System,te_7,53,C
liquid central display ,te_7,23,D
GPS = Global Positioning System ,te_7,32,D
"GPU atau sering juga disebut VGA adalah saalah satu hardware pendukung bagi para desainer dan gamer yang memang kebutuhan grafisnya lebih berat daripada VGA Onboard yang sudah ada dari Mainboard. GPU kepanjangan dari Graphic Processing Unit. Singkatan GPU dan CPU memang tidak jauh berbeda, fungsi utama dari GPU itu sendiri memang di khususkan untuk mem-proses penggunaan grafik yang memang berat dan VGA Onboard tidak sanggup untuk menjalankan kebutuhan grafik tinggi tersebut, namun bukan berarti VGA Onboard sekarang tidak cukup untuk menjalakan beberapa penggunaan grafis grafik sebatas 3D biasa, CPU kepanjangannya adalah Central Processing Unit. CPU bertanggung jawab untuk melakukan semua dari perhitungan matematika yang diperlukan oleh komputer agar dapat berfungsi dengan baik. Dikarenakan komputer tidak dapat berfungsi tanpa CPU (yang mungkin juga disebut sebagai central processor atau hanya prosesor saja), tidak jarang terdengar orang merujuk ke CPU sebagai ""otak"" dari sebuah komputer, GPS atau Global Positioning System dalam pengertian sederhana adalah salah satu sistem yang akan membantu kita untuk mengetahui posisi kita berada saat ini. GPS bekerja dengan menstransmisikan sinyal dari satelit ke perangkat GPS (handphone atau Blackberry yang dilengkapi teknologi GPS misalnya). Untuk memperoleh detil posisi yang seakurat mungkin, GPS sebaiknya digunakan di ruang terbuka Penggunaan GPS di dalam ruangan, hutan ataupun di tempat yang banyak gedung-gedung tinggi, akan membuat GPS bekerja kurang akurat ",te_7,25,D
"liquid control desktop, control prosesing unit, google prosesing satelit ",te_7,23,D
"LCD Luquid Control Desktop, CPU Control Prosessing Unit, GPS Google Procesor Satlite ",te_7,31,D
"LCD adalah Liquied Control Desktop, CPU adalah Control Processor Unit, GPS adalah Google Proyektor Satelit. ",te_7,28,D
haha ,te_7,0,E
"Cupcake, Donat, Eclair, Froyo, Gingerbread, Honeycomb, Ice Cream Sandwich, Jelly Bean, Kitkat, Lollipop dan Marshmallow ",te_8,88,A
"cupcake,doughnat, eclair, froyo, gingerbread, honeycomb, ice cream sandwich, jelly bean. kitkat, lollipop, marshmellow ",te_8,85,A
"donut,eclair,froyo,gingerbread,honeycomb,ice cream sandwitch, jelly bean,kitkat ",te_8,86,A
"Cupkace, Donut, Eclair, Froyo, Gingerbread, Honeycomb, Ice Cream Sandwich, Jelly Bean, Kit Kat, Marshmallow. ",te_8,84,A
"Cupcake,Donut,Eclair ,Froyo, Gingerbread, Honeycomb , Ice Cream Sandwich , Jelly Bean ,KitKat,Lolipop. ",te_8,91,A
"cupcake, donut, eclair, froyo, gingerbread, honeycomb, ice cream Sandwich, jelly bean, kitkat, lollipop, Marshmallow ",te_8,91,A
-Cupcake -Donut -Eclair -Froyo -Gingerbread -Honeycomb -Ice Cream Sandwich -Jelly Bean -KitKat,te_8,88,A
"2.3 Android Cupcake, Android Donut, Android Eclair, Android Eclair, Android Froyo, Android Gingerbread, Android Honeycomb, Android Ice Cream Sandwich, Android Jelly Bean, Android KitKat, Android Lollipop, Android Marshmallow ",te_8,80,A
"Cupcake,Donut,Eclair,Froyo,Gingerbread,Honetcome,ICS,Jelly Bean,KitKat,Lolipop,Marsmallow ",te_8,82,A
"Donut , eclair , froyo , gingerbread , honeycomb , icecream sandwich , jellybean , kitkat , lollipop , marsmallow ",te_8,88,A
"Cupcakes, Donuts, Eclair, Froyo, Gingerbread, Honeycomb, Ice cream sandwich, Jelly Bean, KitKat, Lollipop, Marshmallow ",te_8,91,A
"Cupcake,Donat,Eclare,Foyo,Gingerbread,Honeycomb,IcecreamSandwich,Jellybean,Kitkat,Lolipop,Marshmallow ",te_8,87,A
"donut, eclair, froyo, gingerbread, honeycomb, ice cream sandwich, jelly bean, kitkat ",te_8,83,A
-Cupcake -Donut -Eclair -Froyo -Gingerbread -Honeycomb -Ice Cream Sandwich -Jelly Bean -KitKat,te_8,88,A
"cupcake, donut, eclair, froyo, gingerbread, honeycomb, ice cream sendwich, jelly bean, kitkat, lollipop, marsmellow ",te_8,91,A
cupcake - doughnut - eclair - froyo - gingerbread - honeycomb - ice cream sandwich - jellybean - kitkat - lollipop - marshmallow. ,te_8,85,A
"cupcake, donut, eclair, froyo, gingerbread,honeycomb, ice cream sandwich, jellybean, KitKat, lollipop, marshmellow, nuttelo. ",te_8,88,A
cupcake donut eclair froyo ginger bread honeycamb ice cream sandwich jelly bean kit kat lollipop marshmallow ,te_8,89,A
"Cupcake , Donut, Eclair, Froyo, Gingerbread, Honeycomb, Ice Cream Sandwich, Jelly Bean, dan KitKat. ",te_8,88,A
"Cupcake, Donut), Eclair, Froyo, Gingerbread), Honeycomb, Ice Cream Sandwich, Jelly Bean, KitKat, Lollipop, Marsmellow ",te_8,91,A
1. Android versi 1.0 (Astro) 2. Android versi 1.1 (Bender) 3. Android versi 1.5 (Cupcake) 4. Android versi 1.6 (Donut) 5. Android versi 2.0/2.1 (Eclair) 6. Android versi 2.2 (Froyo: Frozen Yoghurt) 7. Android versi 2.3 (Gingerbread) 8. Android versi 3.0/3.1 (Honeycomb) 9. Android versi 4.0 (ICS: Ice Cream Sandwich) 10. Android versi 4.1 (Jelly Bean) 11. Android versi 4.4 (KitKat) 12. Android L 5.0 ,te_8,72,B
"Cupcake (1.5), Donut (1.6), Eclair (2.0–2.1), Froyo (2.2–2.2.3), Gingerbread (2.3–2.3.7), Honeycomb (3.0–3.2.6), Ice Cream Sandwich (4.0–4.0.4), Jelly Bean (4.1–4.3), KitKat (4.4+), dan lolypop (5.0). ",te_8,77,B
"yakni Cupcake (1.5), Donut (1.6), Eclair (2.0–2.1), Froyo (2.2–2.2.3), Gingerbread (2.3–2.3.7), Honeycomb (3.0–3.2.6), Ice Cream Sandwich (4.0–4.0.4), Jelly Bean (4.1–4.3), dan KitKat (4.4+), Android Lollipop 5.0, ",te_8,77,B
"- Donut, - eclair - ginggerbread - honeycomb - icecream sandwich - jellybean - kitkat - lollipop - marsmallow ",te_8,68,B
- Cupcake - Donut - Friyo - Ginger Bread - Ice Creamsinwich - Jelly Bean - KitKat - Lolipop - Marsmallow - Nutella,te_8,75,B
- Donut (1.6) - Eclair (2.0–2.1) - Froyo (2.2–2.2.3) - Gingerbread (2.3–2.3.7) - Honeycomb (3.0–3.2.6) - Ice Cream Sandwich (4.0–4.0.4) - Jelly Bean (4.1–4.3) - KitKat (4.4+). ,te_8,67,B
"Cupcake (1.5), Donut (1.6), Eclair (2.0–2.1), Froyo (2.2–2.2.3), Gingerbread (2.3–2.3.7), Honeycomb (3.0–3.2.6), Ice Cream Sandwich (4.0–4.0.4), Jelly Bean (4.1–4.3), dan KitKat (4.4+), Lollipop 5.0 ",te_8,72,B
"Cupcake,donat,eclaire,froyo,gingabeard,honeycomb,ice cream sandwich,jellybeans,kitkat,lolipop,,martabak ",te_8,76,B
- Android Cupcake - Android Donut - Android Eclair - Android Froyo - Android Jellybean,te_8,45,C
"Android Beta, Android 1.1 (Bender), Android 1.5 Cupcake, Android 1.6 Donut, Android 2.0/2.1 Encla, Android 2.3 Gingerbread, Android 2.2 Frozen Yoghurt (Froyo), Android 3.0/3.1 Honeycomb, Android 4.0 Ice Cream Sandwich, ",te_8,43,C
- Donut (Androidversi 1.6) - Eclair (Android versi 2.0 - 2.1) - Froyo (Android versi 2.2 - 2.2.3) - Gingerbread (Android versi 2.3 - 2.4) - Honeycomb (Android versi 3.0 - 3.2) - Ice Cream Sandwich (Android versi 4.0) - Jelly Bean (Android versi 4.1 - 4.3),te_8,55,C
- Cupcake (Android versi 1.2 - 1.5) - Donut (Androidversi 1.6) - Eclair (Android versi 2.0 - 2.1) - Froyo (Android versi 2.2 - 2.2.3) - Gingerbread (Android versi 2.3 - 2.4) - Honeycomb (Android versi 3.0 - 3.2) - Ice Cream Sandwich (Android versi 4.0) - ,te_8,53,C
"Android donat, ecliyer, froyo, gingabread, ice cream sandwith, jellybean, kitkat, lolypop, marshmallo ",te_8,56,C
"gingerbread , ice cream sandwich ",te_8,28,D
cupcake. gingerbread. jellybean. kitkat. lolipop. marshmellow. ,te_8,32,D
"ice cream, jelly bean, gingerbread ",te_8,30,D
-ics -Jellybean -KitKat -lilipop -mashmellow,te_8,28,D
"jelly beans, lollypoop ",te_8,10,E
"Android, Beta, Centa, Delta, Entiti ,Fair ,Game ,Have ,Int ,Juanda, Kitkat, Lolipop. ",te_8,12,E
"jelly bean, kit-kat ",te_8,19,E
android cupcake versi curve ,te_8,7,E
"Topologi adalah cara stasiun atau host (node) saling dihubungkan. beberpa jenis topologi Jaringan lan yang ada dan sering di terapkan yaitu Point-to-point, Bus (Multipoint), Ring, Star, dan Tree. ",te_9,45,C
"Pengertian Topologi jaringan adalah bagian yang menjelaskan hubungan antar komputer yang di bangun berdasarkan kegunaan, keterbatasan resource dan keterbatasan biaya, berarti topologi-topologi jaringan yang ada bisa disesuaikan dengan keadaan di lapangan. Contoh Topologi Bus, Star, token ring, tree, ",te_9,45,C
"topologi jaringan komputer. topologi bus,topologi ring, topologi star ",te_9,45,C
LAN (Local Are Network) menghubungkan satu komputer dengan komputer lainnya yang berada dalam satu wilayah jaringan. 1. Topologi Bus. 2. Topologi Star. 3. Topologi Tree. ,te_9,57,C
"topologi jaringan LAN cara stasiun atau host dihubungkan. contohnya adalah topologi Point to Point, topologi bus, topologi star dan topologi ring ",te_9,47,C
"Topologi Point-to-point Setiap stasiun atau host dihubungkan secara langsung dengan host lain. Setiap host mempunyai kedudukan yang sama sehingga LAN tidak tergantung pada salah satu host. Pada dasarnya hubungan antar stasiun hanya diketahui oleh stasiun yang bersangkutan Topologi Bus (Multipoint) LAN ini merupakan jaringan broadcast karena informasi dikirimkan melalui medium transmisi ke semua stasiun yang tersambung pada medium ini. Setiap stasiun saling dihubungkan melalui suatu medium yang dipergunakan bersama yang dapat berupa kabel, serat optik ataupun gelombang elektromaknetik.. Interface untuk node disambungkan ke medium ini. Tiap-tiap node akan memeriksa address dari informasi yang dikirimkan untuk menentukan siapa penerimanya. LAN juga tidak tergantung pada salah satu node karena kendalinya tersebar (distributed). Keuntungan: jumlah node dapat ditambahkan atau dikurangi tanpa mengganggu operasi yang telah ada. Kerugiannya: kalau tingkat lalu-lintas tinggi dapat terjadi kongesti. Contoh yang terkenal Ethernet. Topologi Ring semua node saling dihubungkan dalam bentuk lingkaran (ring). Informasi berjalan dalam saluran transmisi secara searah (unidirectional), sehingga data beredar di dalam lingkaran. Informasi berjalan dari satu node ke node yang lain. Informasi disalurkan dalam bentuk paket. Tiap paket mengandung alamat sumber dan tujuan. Paket yang diterima oleh satu stasiun akan diperiksa alamatnya, bilamana bukan untuknya paket akan diberikan kepada stasiun berikutnya demikian seterusnya sehingga tiba di tempat tujuan. Paket ini kemudian akan beredar sampai kembali ke sumber dan kemudian dikeluarkan dari peredaran. Paket harus dibuang untuk menghindari beredarnya tanpa batas dalam ring tersebut. Paket juga dapat dibuang oleh stasiun yang dituju. Pembuangan paket oleh sumber lebih disukai karena memungkinkan konfirmasi otomatis .Setiap node di dalam LAN ini akan saling bergantungan. Bila satu node terganggu, maka seluruh LAN akan terganggu, akan tetapi sekarang telah ada teknik untuk mengatasi masalah ini yaitu dengan cara melepaskan node yang tidak bekerja dari LAN tersebut dan menggantikannya dengan node yang berdekatan. Teknik ini memerlukan peralatan yang lebih rumit. Tiap node yang ada pada ring mempunyai repeater (transceiver) yang melakukan tugas tersebut di atas. LAN dengan topologi ini mempunyai keuntungan yaitu data rate tinggi dan dapat melayani lalu lintas yang intensitasnya tinggi serta sambungan point to point membuat transmission error diperkecil. Kerugian topologi ini antara lain sukar menambah atau mengurangi node kerusakan pada media transmisi dapat menghentikan seluruh operasi. Media transmisi yang dipakai dapat berupa twisted pair, kabel koaksial dan serat optik. Topologi Star Stasiun yang tersambung pada jaringan umumnya tidak langsung berhubungan dengan stasiun lain tetapi harus menyalurkannya melalui suatu pusat Stasiun pusat ini seringkali berupa sebuah switch . Semua jalur komunikasi tersambung ke satu titik pusat. Topologi Tree Tidak semua node mempunyai kedudukan yang sama. Node yang kedudukannya lebih tinggi ""menguasai"" node dibawahnya. Jaringan sangat tergantung pada node tertentu terutama pada node yang kedudukannya tertinggi. Karena itu juga dapat disebut sebagai ""hierachical topology"", sedang yang lainnya kedudukan semua node sama disebut sebagai ""peer topology"". ",te_9,45,C
"Topologi Ring Pada topologi ring setiap komputer di hubungkan dengan komputer lain dan seterusnya sampai kembali lagi ke komputer pertama, dan membentuk lingkaran sehingga disebut ring, topologi ini berkomunikasi menggunakan data token untuk mengontrol hak akses komputer untuk menerima data, misalnya komputer 1 akan mengirim file ke komputer 4, maka data akan melewati komputer 2 dan 3 sampai di terima oleh komputer 4, jadi sebuah komputer akan melanjutkan pengiriman data jika yang dituju bukan IP Address dia. topologi jaringan komputer Kelebihan dari topologi jaringan komputer ring adalah pada kemudahan dalam proses pemasangan dan instalasi, penggunaan jumlah kabel lan yang sedikit sehingga akan menghemat biaya. Kekurangan paling fatal dari topologi ini adalah, jika salah satu komputer ataupun kabel nya bermasalah, maka pengiriman data akan terganggu bahkan error. ",te_9,42,C
Topologi jaringan sendiri merupakan suatu bentuk/ struktur jaringan yang menghubungkan antar komputer satu dengan yang lain dengan menggunakan media kabel maupun nirkabel. 1. topologi bus 2. topologi star 3. topologi tree ,te_9,52,C
"topologi jaringan komputer adalah suatu cara atau konsep untuk menghubungkan beberapa atau banyak komputer sekaligus menjadi suatu jaringan yang saling terkoneksi. contoh topologi star, topologin bus, topologi mesh, topologi tree ",te_9,52,C
"jaringan yang menggunakan kabel ftp atau utp. topologi star, topologi bus, dan topologi tree ",te_9,46,C
"LAN adalah Local Area Network, 1. Topologi Bus 2. Topologi Star 3. Topologi RIng ",te_9,49,C
-Topologi adalah suatu cara atau konsep untuk menghubungkan beberapa atau banyak komputer sekaligus menjadi suatu jaringan yang saling terkoneksi. -Topologi star. -Topolog mesh. -Topologi ring.,te_9,51,C
Pengertian topologi jaringan komputer adalah suatu cara atau konsep untuk menghubungkan beberapa atau banyak komputer sekaligus menjadi suatu jaringan yang saling terkoneksi - Topologi Ring - Topologi Bus - Topologi Star ,te_9,52,C
Pengertian topologi jaringan komputer adalah suatu cara atau konsep untuk menghubungkan beberapa atau banyak komputer sekaligus menjadi suatu jaringan yang saling terkoneksi. contohnya: topologi star. topologi bus. topologi tree. ,te_9,55,C
Topologi jaringan LAN (LOCAL Area Network) adalah topologi jaringan bertingkat contoh - Topologi Bus - Topologi Ring - Topologi star ,te_9,52,C
LAN adalah Local Area Network merupakan sebuah node yang saling terhubung dan memanfaatkan beberapa jenis topologi yang ada. contohnya: -point to point -bus -ring ,te_9,49,C
"Topologi LAN adalah topologi untuk desain jaringan contohnya adalah -topologi mesh, -topologi tree, -topologi star, -topologi bus ",te_9,46,C
"topologi LAN adalah topologi pada jaringan komputer yang menggunakan media kabel sebagai jalur transmisinya. contoh : star, bus, ring, mesh, hybird. ",te_9,45,C
"Topoligi LAN adalah topologi jaringan Local atau Local Area Network, topologi tersebut digunakan untuk network kecil seperti di rumah, kos, warung kopi ,dll yang kecil. Contoh topologi adalah Star, Mesh, Tree, Bus, Ring. ",te_9,55,C
"LAN ialah jaringan lokal, penghubung antar pc dalam skala dan jangkauan yang kecil. contoh ( topologi ring, bus, star.) ",te_9,43,C
"- Topologi jaringan suatu konsep untuk menghubungkan lokal ke komputer satu ke komputer yang Lain Contoh : Topologi Bus, Topologi Ring, Topologi Star",te_9,48,C
"Lan adalah local area network adalah topologi jaringan yang memiliki lingkup lokal. Contoh star, bus, tree ",te_9,49,C
"LAN adalah Local Area Network, bus , ring, star, mesh ",te_9,43,C
"LAN adalah Local Area Network. bus, ring, mesh, star. ",te_9,43,C
"Pengertian Topologi jaringan adalah bagian yang menjelaskan hubungan antar komputer yang di bangun berdasarkan kegunaan, keterbatasan resource dan keterbatasan biaya, berarti topologi-topologi jaringan yang ada bisa disesuaikan dengan keadaan di lapangan. Topologi jaringan ada beberapa bentuk sebagai berikut: - Topologi Bus - Topologi Cincin - Topologi Token Ring - Topologi Bintang - Topologi Pohon (tree) ",te_9,55,C
"Pengertian Topologi jaringan adalah bagian yang menjelaskan hubungan antar komputer yang di bangun berdasarkan kegunaan, keterbatasan resource dan keterbatasan biaya, berarti topologi-topologi jaringan yang ada bisa disesuaikan dengan keadaan di lapangan. - Topologi Bus - Topologi Cincin - Topologi Token Ring - Topologi Bintang - Topologi Pohon (tree) ",te_9,55,C
. Topologi adalah cara stasiun atau host (node) saling dihubungkan. - Topologi Point-to-point - Topologi Bus (Multipoint) - Topologi Ring ,te_9,57,C
"Pada topologi ring setiap komputer di hubungkan dengan komputer lain dan seterusnya sampai kembali lagi ke komputer pertama, dan membentuk lingkaran sehingga disebut ring, topologi ini berkomunikasi menggunakan data token untuk mengontrol hak akses komputer untuk menerima data, misalnya komputer 1 akan mengirim file ke komputer 4, maka data akan melewati komputer 2 dan 3 sampai di terima oleh komputer 4. ",te_9,33,D
"Tipologi star,Bus,Tree,Ring ",te_9,27,D
"jaringan yang mencakut dalam satu area , untuk gedung , untuk rumah , untuk pabrik ",te_9,20,D
jaringan Local Area Network adalah jaringan antar satu gedung ,te_9,24,D
"topologi point to point, topologi bus(multipoint), topologi ring, topologi star, topologi tree ",te_9,29,D
topologi lan adalah topologi pada jaringan komputer yang menggunakan media kabel sebagai jalur transmisinya ,te_9,25,D
"LAN merupakan network atau jaringan sejumlah sistem komputer yang lokasinya terbatas didalam satu gedung, satu kompleks gedung atau suatu kampus dan tidak menggunakan media fasilitas komunikasi umum seperti telepon, melainkan pemilik dan pengelola media komunikasinya adalah pemilik LAN itu sendiri. ",te_9,28,D
"local area network. star, ring, smesh ",te_9,30,D
"local area network, utp, udp, telnet ",te_9,22,D
"Topologi jaringan LAN (Local Area Network) adalah sebuah areal lokal jaringan dan contohnya UTP, UDP, Telnet, Ssh ",te_9,27,D
"Lan adalah Local Area Network contoh Utp,Udp,Telnet, SSH dan lain lain ",te_9,26,D
jaringan dengan kabel ,te_9,11,E
jaringan dengan kabel ,te_9,18,E
Topologi Star Gemini Sagitarius ,te_9,8,E
Baper ,te_9,0,E
- ,te_9,0,E
Bluetooth adalah spesifikasi industri untuk jaringan kawasan pribadi (personal area networks atau PAN) tanpa kabel. Bluetooth menghubungkan dan dapat dipakai untuk melakukan tukar-menukar informasi di antara peralatan-peralatan. ,te_10,63,B
Bluetooth adalah spesifikasi industri untuk jaringan kawasan pribadi (personal area networks atau PAN) tanpa kabel. Bluetooth menghubungkan dan dapat dipakai untuk melakukan tukar-menukar informasi di antara peralatan-peralatan. ,te_10,63,B
Bluetooth adalah spesifikasi industri untuk jaringan kawasan pribadi (personal area networks atau PAN) tanpa kabel. Bluetooth menghubungkan dan dapat dipakai untuk melakukan tukar-menukar informasi di antara peralatan-peralatan. Spesifiksi dari peralatan Bluetooth ini dikembangkan dan didistribusikan oleh kelompok Bluetooth Special Interest Group. ,te_10,70,B
"Bluetooth adalah suatu peralatan media komunikasi yang dapat digunakan untuk menghubungkan sebuah perangkat komunikasi dengan perangkat komunikasi lainnya, bluetooth umumnya digunakan di handphone, komputer atau pc, tablet, dan lain-lain. Fungsi bluetooth yaitu untuk mempermudah berbagi atau sharing file, audio, menggantikan penggunaan kabel dan lain-lain. Saat ini sudah banyak sekali perangkat yang menggunakan bluetooth. ",te_10,66,B
Bluetooth adalah spesifikasi industri untuk jaringan kawasan pribadi (personal area networks atau PAN) tanpa kabel. Bluetooth menghubungkan dan dapat dipakai untuk melakukan tukar-menukar informasi di antara peralatan-peralatan. ,te_10,52,C
Bluetooth adalah jaringan pribadi tanpa kabel. dapat dipakai untuk tukar-menukar informasi antar perangkat ,te_10,57,C
Bluetooth adalah teknologi nirkabel (tanpa kabel) yang dapat menyambungkan beberapa perangkat melalui gelombang radio frekuensi rendah. Bluetooth menggunakan gelombang radio yang omni direksional dan dapat menembus dinding. Jadi perangkat yang memiliki bluetooth pada area tertentu akan saling tersambung tanpa digabungkan dengan seutas kabel. Bluetooth menyediakan transfer data 720 Kbps dalam jarak 40 meter. ,te_10,53,C
Bluetooth adalah spesifikasi industri untuk jaringan kawasan pribadi (personal area networks atau PAN) tanpa kabel. Bluetooth menghubungkan dan dapat dipakai untuk melakukan tukar-menukar informasi di antara peralatan-peralatan. ,te_10,52,C
menghubungkan dan dapat dipakai untuk melakukan tukar menukar informasi di antara peralatan peralatan ,te_10,47,C
Bluetooth adalah spesifikasi industri untuk jaringan kawasan pribadi (personal area networks atau PAN) tanpa kabel. Bluetooth menghubungkan dan dapat dipakai untuk melakukan tukar-menukar informasi di antara peralatan-peralatan. Spesifiksi dari peralatan Bluetooth ini dikembangkan dan didistribusikan oleh kelompok Bluetooth Special Interest Group. ,te_10,57,C
Bluetooth adalah spesifikasi industri untuk jaringan kawasan pribadi (personal area networks atau PAN) tanpa kabel. Bluetooth menghubungkan dan dapat dipakai untuk melakukan tukar-menukar informasi di antara peralatan-peralatan. ,te_10,53,C
bluetooth adalah spesifikasi industri untuk jaringan dengan kawasan pribadi / PAN tanpa kabel yang berfungsi untuk melakukan tukar menukar informasi antara gadget yang memiliki konektivitas bluetooth. ,te_10,46,C
spesifikasi industri untuk jaringan kawasan pribadi (personal area networks atau PAN) tanpa kabel. Bluetooth menghubungkan dan dapat dipakai untuk melakukan tukar-menukar informasi di antara peralatan-peralatan. ,te_10,40,C
Bluetooth adalah spesifikasi industri untuk jaringan kawasan pribadi (personal area networks atau PAN) tanpa kabel. Bluetooth menghubungkan dan dapat dipakai untuk melakukan tukar-menukar informasi di antara peralatan-peralatan. ,te_10,48,C
spesifikasi industri untuk jaringan kawasan pribadi (personal area networks atau PAN) tanpa kabel. Bluetooth menghubungkan dan dapat dipakai untuk melakukan tukar-menukar informasi di antara peralatan-peralatan. ,te_10,48,C
Bluetooth adalah spesifikasi industri untuk jaringan kawasan pribadi (personal area networks atau PAN) tanpa kabel. Bluetooth menghubungkan dan dapat dipakai untuk melakukan tukar-menukar informasi di antara peralatan-peralatan. ,te_10,42,C
"Bluetooth adalah suatu peralatan media komunikasi yang dapat digunakan untuk menghubungkan sebuah perangkat komunikasi dengan perangkat komunikasi lainnya, bluetooth umumnya digunakan di handphone, komputer atau pc, tablet, dan lain-lain. ",te_10,30,D
untuk menstranfer suatu file ,te_10,23,D
Bluetooth adalah teknologi jaringan tanpa kabel yang berjarak pendek untuk menghubungkan 2 alat ,te_10,29,D
suatu alat untuk tranfer file yang terbatas jarak. ,te_10,25,D
teknologi sinyal untuk menghubungkan perangkat dalam pengiriman dan penerimaan data ,te_10,30,D
Bluetooth adalah spesifikasi industri untuk jaringan kawasan pribadi (personal area networks atau PAN) tanpa kabel. ,te_10,31,D
"Suatu peralatan media komunikasi yang dapat digunakan untuk menghubungkan sebuah perangkat komunikasi dengan perangkat komunikasi lainnya, bluetooth umumnya digunakan di handphone, komputer atau pc, tablet, dan lain-lain. ",te_10,29,D
Bluetooth merupakan media untuk transfer data ,te_10,26,D
Bluetooth adalah suatu peralatan media komunikasi yang dapat digunakan untuk menghubungkan sebuah perangkat komunikasi dengan perangkat komunikasi lainnya. ,te_10,29,D
Bluetooth adalah Gigi Biru atau biasa digunakan untuk menghubungan perangkat elektronik yang ingin bertukar data. ,te_10,28,D
fitur transfer data dengan jarak tertentu tanpa koneksi internet ,te_10,21,D
Bluetooth adalah media pengiriman yang menggunakan frequensi tertentu ,te_10,23,D
Bluetuooth suatu software yang di gunakan untuk mentrasnfer data tanpa menggunakan peralatan - peralatan bantuan seperti kabel. ,te_10,31,D
Bluetooth adalah spesifikasi industri untuk jaringan kawasan pribadi (personal area networks atau PAN) tanpa kabel. Bluetooth menghubungkan dan dapat dipakai untuk melakukan tukar-menukar informasi di antara peralatan-peralatan ,te_10,32,D
Bluetooth adalah spesifikasi industri untuk jaringan kawasan pribadi (personal area networks atau PAN) tanpa kabel ,te_10,28,D
media share data tanpa kabel ,te_10,22,D
bluetooth adalah spesifikasi industri untuk jaringan pribadi tanpa kabel ,te_10,25,D
Bluetooth adalah sebuah media yang di gunakan untuk berbagi (share) data. ,te_10,26,D
adalah sebuah sisstem yang berfungsi untuk transfer file atau data tanpa melalui kabel ,te_10,27,D
digunakan untuk mengirim/ mentrasfer data atau file ,te_10,28,D
transfer antar hape ,te_10,15,E
Jaringan yang digunakan untuk pengiriman data ,te_10,19,E
menstransfer data melalui ponsel ,te_10,15,E
Blue = biru tooth= gigi jadi gigi biru ,te_10,0,E
bluetooth adalah spesifikasi industri untuk untuk jaringgan dengan kawasan pribadi ,te_10,19,E
penghubung nirkabel antar device dengan jarak jangkauan yang terbatas dan sempit. ,te_10,9,E
Blue=Biru Tooth=Gigi Jadi Gigi Biru ,te_10,0,E
